{
  "update_id": "UPD-20260419-140500-verifier-agent-task-creation-01",
  "submitted_at": "2026-04-19T14:52:00-06:00",
  "submitted_by": "verifier-agent:task-creation",
  "role": "verifier-agent",
  "_prompt_version": "a46a3977faab",
  "_state_revision_at_start": 5,
  "target_feature": "task-creation",
  "resource_claim_id": null,
  "summary": "task-creation passed FUNCTIONAL gate. Advancing status to VERIFIED. ISSUE-001 (whitespace trim) acknowledged - partially fixed during follow-up, MEDIUM priority. Gate artifact written.",
  "changes": [
    {
      "op": "set",
      "path": "features.task-creation.status",
      "value": "VERIFIED"
    },
    {
      "op": "append",
      "path": "gates.task-creation",
      "value": {
        "gate_attempt_id": "GATE-20260419-140000-task-creation-functional",
        "artifact": ".agents/gates/2026-04-19-1400-task-creation-functional.json",
        "gate": "FUNCTIONAL",
        "date": "2026-04-19",
        "result": "PASS",
        "verified_by": "verifier-agent",
        "functional_subpasses": {
          "static": "PASS",
          "behavioral": "PASS"
        },
        "known_issue_ids": ["ISSUE-001"]
      }
    },
    {
      "op": "set",
      "path": "do_not_break.task-creation-form",
      "value": "TaskCreationForm - all 8 ACs passing as of 2026-04-19 FUNCTIONAL gate"
    }
  ]
}
